{
 "schema": "magnet_coil_qualification_v1",
 "schema_file": "docs/experiments/magnet_coil/magnet_coil_qualification_v1.schema.json",
 "id": "fo_magnet_coil_qualification",
 "title": "H-1 magnet/coil qualification basis (candidate grades, insulation systems, conductors)",
 "status": "DRAFT_FOR_OWNER_REVIEW",
 "date": "2026-09-27",
 "lane": {
  "id": "fo_magnet_coil_qualification",
  "trigger": "T_PIVOT_MAGNET_COIL_QUALIFICATION",
  "owner_disposition": "od_hardware_pivot",
  "decision_file": "docs/decisions/OD_HARDWARE_PIVOT_2026_09_27.json"
 },
 "builder": "docs/experiments/magnet_coil/build_magnet_coil_qualification.py",
 "milestones": {
  "supports": [
   "A",
   "C"
  ],
  "A": "Supports conditional selection only as a CONDITION LIST: 'architecture X is baseline provided H-1 (and, for ecr_hall, the PIM-ECR magnet) passes MCQ-QT-01..09 at the measured temperatures'. The magnet/coil set is common to all three arms (hall_only, rf_hall, ecr_hall) except the ecr_magnet, so it does not discriminate architectures; it gates S1 readiness (S1_gate_items) on the path S1 -> LOCK-2 -> HW-0/HW-RF/HW-ECR.",
  "B": "Not supported directly. It enables B-relevant evidence: B(z) at actual coil currents and temperatures (MCQ-W4-03) is a W5 held-out candidate; no Hall transport closure is used or needed here.",
  "C": "Supports the proposal/PDR freeze for the magnet/coil life and thermal items (lane 15 hall_magnet and ecr_magnet nodes).",
  "to_reach_next": [
   "S1: all MCQ-S1-* items delivered, owner answers MCQ-OQ-01..03 and MCQ-OQ-06",
   "Milestone C: MCQ-QT-01 life basis at the measured hot spot, MCQ-QT-04 AO results, lane 15 records adopted (MCQ-TL-*), H-1 thermal model correlated to S1 data"
  ]
 },
 "hard_statements": [
  "DRAFT for owner review. No candidate is qualified, selected, passed or failed.",
  "No lifetime verdict is produced; every candidate has lifetime_verdict = null.",
  "Generic MIL class-C derating (EEE-INST-002) and generic MMPA family values are REFERENCE EVIDENCE ONLY.",
  "Thresholds not in the RFP are PROPOSED.",
  "No Hall transport closure, screening candidate or P5 value is used as a design or performance value.",
  "No architecture winner is declared; the magnet/coil set is common to hall_only, rf_hall and ecr_hall except the ecr_magnet.",
  "No 15,000 h extrapolation from an unadmitted Hall closure (control C6)."
 ],
 "vocabulary": {
  "evidence_level": "1-7 as defined in docs/EVIDENCE.md (source strength and proximity)",
  "quantity_type": [
   "measured",
   "digitized",
   "inferred",
   "reconstructed",
   "model-derived",
   "assumed"
  ],
  "status_candidate": {
   "CANDIDATE": "sourced enough to enter qualification planning",
   "CANDIDATE_INCOMPLETE_DATA": "a key datum (curves, E595, rating) is not sourced",
   "NOT_SOURCED_FOR_SELECTION": "named option without usable supplier data"
  },
  "TBD": "a value null with a 'TBD - requires ...' string: not given by any accessed source; never filled"
 },
 "sources": {
  "arnold_recoma_combined": {
   "citation": "Arnold Magnetic Technologies, Recoma Sintered Samarium Cobalt Magnets - combined grade datasheets (summary table 'Summary of main grades of SmCo5 and Sm2Co17' and per-grade sheets; (c) 2014; Recoma 33E sheet Rev. 140403a)",
   "url": "https://www.arnoldmagnetics.com/wp-content/uploads/2017/10/Recoma-Combined-160301.pdf",
   "access": "manufacturer datasheet, openly accessible; states data are typical, for general reference only, not guaranteed",
   "sha256_accessed": "4da6cbd3eced4ffca114f2756163ea2767aecfec5033a227d71b4b50b308e79e",
   "locator_convention": "physical PDF page"
  },
  "arnold_recoma_ht": {
   "citation": "G. Martinek, U. Wyss (Arnold Magnetic Technologies), RECOMA HT - Rare Earth Magnets for High Temperatures (application note)",
   "url": "https://www.arnoldmagnetics.com/wp-content/uploads/2020/05/Recoma-HT.pdf",
   "access": "manufacturer application note, openly accessible; demagnetization curves are graphical only",
   "sha256_accessed": "2ceb8c12e65c342e751a58027b98e6ade2ef7fced8ccd1ab856b93e2934a9215",
   "locator_convention": "printed page number ('Arnold Magnetic Technologies | n')"
  },
  "eec_uht_smco_page": {
   "citation": "Electron Energy Corporation, 'Ultra-High Temperature Samarium Cobalt Magnets' (product web page)",
   "url": "https://www.electronenergy.com/ultra-high-temperature-samarium-cobalt-magnets/",
   "access": "manufacturer web page, openly accessible; no grade datasheet with demagnetization curves was accessed",
   "sha256_accessed": "28fc90de7eedeac0947c9e874c347f58ee82c132eb8be137f43a29f9e003b08f",
   "locator_convention": "web page body text"
  },
  "arnold_neo_catalog": {
   "citation": "Arnold Magnetic Technologies, Neodymium-Iron-Boron Magnet Grades - Summary Product List & Reference Guide, Rev. 181031 (file name Catalog-151021.pdf)",
   "url": "https://www.arnoldmagnetics.com/wp-content/uploads/2017/10/Catalog-151021.pdf",
   "access": "manufacturer catalog, openly accessible; the column heading 'Tw max' is not defined in the accessed text",
   "sha256_accessed": "9e4ca93492b7bb43b175dcdf681d7c541f952ed1667eaec86cdd20aeef47c202",
   "locator_convention": "physical PDF page"
  },
  "arnold_n35eh": {
   "citation": "Arnold Magnetic Technologies, N35EH sintered NdFeB datasheet, Rev. 210607",
   "url": "https://www.arnoldmagnetics.com/wp-content/uploads/2017/11/N35EH-151021.pdf",
   "access": "manufacturer datasheet, openly accessible; demagnetization curves (-40 to 220 C) graphical only; no maximum-use row",
   "sha256_accessed": "981d77c484b1ba37c108aaec10b055f8f2c5b114c8b2ae10a59ad3c200e4cf7c",
   "locator_convention": "single-page datasheet"
  },
  "arnold_n42sh": {
   "citation": "Arnold Magnetic Technologies, N42SH sintered NdFeB datasheet (re-accessed; same file as lane 15 source arnold_n42sh in schemas/thermal_life/limits_v1.json)",
   "url": "https://www.arnoldmagnetics.com/wp-content/uploads/2017/11/N42SH-151021.pdf",
   "access": "manufacturer datasheet, openly accessible; no maximum-use row",
   "sha256_accessed": "c0bd4c03ba5896d2de9cbdd4d5ac9a1e16da4815a4cfdd8bcb132918c8953a36",
   "locator_convention": "single-page datasheet"
  },
  "mmpa_0100_00": {
   "citation": "Magnetic Materials Producers Association, MMPA Standard No. 0100-00, Standard Specifications for Permanent Magnet Materials (re-accessed; same source as lane 15 mmpa_0100_00; publication year not printed in the accessed copy: verify)",
   "url": "https://allianceorg.com/pdfs/MMPA_0100-00.pdf",
   "access": "full text on a third-party host (Alliance LLC); page 20 was rendered as an image and inspected on 2026-09-27",
   "sha256_accessed": "3d83974ac1f08635311a415d9245fc3183bc0c2aab540cf8bd77afecb5892792",
   "locator_convention": "printed page number"
  },
  "remington_mw16c": {
   "citation": "Remington Industries, Polyimide-Enameled Copper Magnet Wire MW 16-C Data Sheet (drawn AG 10/13/21)",
   "url": "https://www.remingtonindustries.com/content/Polyimide%20Magnet%20Wire%20Data%20Sheet.pdf",
   "access": "supplier datasheet, openly accessible (a distributor, not the enamel manufacturer)",
   "sha256_accessed": "ba3d5e2284da9b9267e68aa0918cd07361e8f3a96c07036b5a56470daa44d7b6",
   "locator_convention": "single-page datasheet"
  },
  "nema_mw1000_annex_c": {
   "citation": "ANSI/NEMA MW 1000-2016, Annex C (informative): Cross Reference of NEMA and IEC Magnet Wire Specifications",
   "url": "https://www.nema.org/docs/default-source/products-document-library/ansi-nema-mw-1000-2016---annex-c.pdf",
   "access": "publisher-posted annex, openly accessible; the standard itself was not accessed",
   "sha256_accessed": "cb8e2b060fb59597497c63497b7c42d8888b2e7380c49ae06c685750dd415c04",
   "locator_convention": "physical PDF page"
  },
  "ceramawire_ht": {
   "citation": "Ceramawire, High Temperature Magnet Wire - Technical Specifications (HT Wire)",
   "url": "https://www.motionsensors.com/wp-content/uploads/2022/07/ceramaTechspec.pdf",
   "access": "manufacturer technical specification, accessed via a distributor copy (Motion Sensors Inc.); the manufacturer host ceramawire.com returned a proxy 502 on 2026-09-27 and was not retried by other means",
   "sha256_accessed": "dde43a06de652f483f004b5f89be91284fedd60d56fca902018a0be1929948f5",
   "locator_convention": "physical PDF page"
  },
  "honeywell_us9508486": {
   "citation": "J. Piascik et al. (Honeywell International Inc.), High temperature electromagnetic coil assemblies, US Patent 9,508,486 B2, 29 Nov 2016 (division of US 8,572,838)",
   "url": "https://image-ppubs.uspto.gov/dirsearch-public/print/downloadPdf/9508486",
   "access": "USPTO image PDF, openly accessible; only the front page (abstract) was read (no text layer, no OCR)",
   "sha256_accessed": "befa4064fa439f168d0fa23f11066375ca6c7aae1e21f4fd61cf782183a38a7b",
   "locator_convention": "front page, item (57) Abstract"
  },
  "nasa_myers_2016_hermes": {
   "citation": "J. Myers, H. Kamhawi, J. Yim, L. Clayman, Hall Thruster Thermal Modeling and Test Data Correlation, AIAA Propulsion and Energy Conference, Salt Lake City, July 2016 (NTRS 20170000961)",
   "url": "https://ntrs.nasa.gov/api/citations/20170000961/downloads/20170000961.pdf",
   "access": "full text, openly accessible (NASA NTRS)",
   "sha256_accessed": "8a9f79089c8630123b2e1ec8ad0740dcd3141377d897462ca1ebcbf7d5c8e85f",
   "locator_convention": "physical PDF page"
  },
  "nasa_kamhawi_2013_300ms": {
   "citation": "H. Kamhawi et al., Performance and Thermal Characterization of the NASA-300MS 20 kW Hall Effect Thruster, IEPC-2013-444, 33rd IEPC, Washington DC, 2013 (NTRS 20140017775)",
   "url": "https://ntrs.nasa.gov/api/citations/20140017775/downloads/20140017775.pdf",
   "access": "full text, openly accessible (NASA NTRS); Table 4 read from the rendered page image",
   "sha256_accessed": "9e71d7ce85f7f4bca153ddd5dec03b0ee7e782f880e324ed205859eb260bd97e",
   "locator_convention": "physical PDF page"
  },
  "nasa_jankovsky_1999": {